author,body,created_utc,id,score,subreddit,created_datetime
EfeAmbroseBallonDor,"If they're asking for a white coffee they obviously don't know what a latte is do they?   

Could you no just have asked them if they wanted their milk frothed or just fired in the cup with hotwater?",1643287151,hufjknb,1,glasgow,2022-01-27T12:39:11Z
samstones,Forgot my coffee cup GOD FUCKINg dAMMIT,1643287139,hufjjvf,1,wallstreetbets,2022-01-27T12:38:59Z
Lnndam,"Not really an answer to your question, but have you read 'Anyone Can Do It' by Bobby and Sahar Hashemi? Really interesting book about starting a coffee store, especially when your based in London.",1643287116,hufjihk,1,smallbusiness,2022-01-27T12:38:36Z
PumpkinSpicedbagel,Bleach..... pumpkin/cinnamon.... coffee .... fresh baked cookies and bread,1643287098,hufjhcb,1,ChildofHoarder,2022-01-27T12:38:18Z
KitchenBag5246,Spit my coffee out thanks,1643287080,hufjg6y,1,TLCsisterwives,2022-01-27T12:38:00Z
YoureAllCucksPKA,"If you're buying any of these supplements at all you're getting scammed you fucking morons, you really think Derek's super special crazy formula is that much different to a cup or two of coffee get fucking real here.

Not saying you can't buy the product, it's it's just an easy -50 to -100 dollars for a marginal improvement. An improvement half the fucks don't need, you're pounding gorilla shit like those people that buy 240hz monitors and leave the refresh rate at 60hz",1643287064,hufjf68,1,moreplatesmoredates,2022-01-27T12:37:44Z
poopy__bunghole,Thought of ordering coffee but the prices from third wave made me even more awake. So no coffee it is,1643287063,hufjf3l,1,unitedstatesofindia,2022-01-27T12:37:43Z
Knowledge-Future,Quesadilla and coffee. That's definitely Petrie. A good place to learn. Back in the day I learned in some old TAFE and uni buildings in Kangaroo Point and interstate. Some of those place were decommissioned or moved to South Brisbane and elsewhere nowadays. Practical but not as nice as the modern facilities and universities.,1643287061,hufjeyq,1,brisbane,2022-01-27T12:37:41Z
BlueWhitestuff2155,Good choice. Nothing like sitting on a chair sipping some hot coffee with your eyes closed while Miranda Cosgrove's juicy lips are wrapped around your cock after a long day.,1643287060,hufjevt,1,CelebAssPussyMouth,2022-01-27T12:37:40Z
Brendy02,"Someone already got it, but I was going to guess some sort of coffee.",1643287051,hufjeb1,1,teenagers,2022-01-27T12:37:31Z
flounderfarts69,"The coffee shops make mad cash, not the employees lol.",1643287049,hufje7j,1,mildlyinfuriating,2022-01-27T12:37:29Z
WatchExBot,"Thank you for tagging the Confirmation Bot. This comment is now being tracked. Your flair will update once your partner replies to your comment.

u/due-opinion4875, please reply to the above comment with your feedback for your transaction partner. Once you do so, you will both get credit for this transaction and your flair scores will increase.

u/due-opinion4875, if you did **NOT** complete a transaction with this person, please **DO NOT** reply to their comment as this will confirm the transaction. Instead, please [message the moderators](https://www.reddit.com/message/compose/?to=r/watchexchange&amp;subject=Incorrectly%20Tagged%20Confirmation&amp;message=I%20was%20incorrectly%20tagged%20in%20this%20comment%3A%20https%3A%2F%2Fwww.reddit.com%2Fcomments%2Fs78371%2F-%2Fhufj61f) so we can contact the user and handle the situation.

Thank you!

---

[^(Buy the developer a coffee)](https://kofi.regexr.tech)",1643287041,hufjdpo,1,Watchexchange,2022-01-27T12:37:21Z
This_Persimmon3363,"Mmm...that ""strong"" coffee looks appetizing!",1643287035,hufjdcn,1,CoffeeGoneWild,2022-01-27T12:37:15Z
LagunovMike,"I tried several times. You need to clean your Aeropress really heavily beforehand (especially the rubber gasket) because otherwise your tea will have coffee tingle. But even if you clean, I couldn't find any difference from my tea brewing kettle. Tea almost doesn't have fine particles that can pass through even wide mesh filter",1643287031,hufjd48,1,AeroPress,2022-01-27T12:37:11Z
Mrtn_D,"Upon reading it again, that came out a little wonky. Most brewers like a Sage Precision Brewer or Moccamaster don't a built-in grinder. And people in your situation then frequently buy already ground coffee, which will go stale pretty quickly. 

The Grind Control obviously has a built-in grinder, so that way you would be able to enjoy freshly ground coffee too.",1643287015,hufjc6t,1,Coffee,2022-01-27T12:36:55Z
CautiousToaster,Coffee shop barista / latte artist,1643287010,hufjbv0,1,neoliberal,2022-01-27T12:36:50Z
GerraldTMS,Episode 411 (Dave Asprey) Bulletproof Coffee - so bulletproof coffee was on the episode? Pls explain m8,1643287006,hufjbn8,1,JoeRogan,2022-01-27T12:36:46Z
OGgunter,"Aww, I'm sorry that's happening as well. 

Do you have anyone you know from church you could reach out to and chat? Maybe schedule a virtual coffee or the like?",1643286994,hufjaw4,1,disability,2022-01-27T12:36:34Z
eugoogilizer,"It’s cool, he’ll just be payin $5 for coffee, that’s all 😂",1643286971,hufj9gz,1,mildlyinfuriating,2022-01-27T12:36:11Z
Remarkable_Garage_42,"I like old school techniques personally. I make drip coffee but I use a kettle and some trash I converted into a coffee maker. It tastes good, costs little, and most importantly, I like it.",1643286965,hufj94z,1,conspiracy,2022-01-27T12:36:05Z
TooNiceOfaHuman,Same. I had a really awesome customer base in a coffee shop outside of Seattle. I imagine it’s nowhere near like that now.,1643286959,hufj8sw,1,AskReddit,2022-01-27T12:35:59Z
polnikes,"It's way too easy to astroturf these things. Also, Marine Atlantic prepping a special meal? That's pretty laughable. I took those ferries a few weeks back and it was hard enough to even find coffee with the covid rules....",1643286950,hufj893,1,CanadaPolitics,2022-01-27T12:35:50Z
Authinus,"No coffee is the middle, I think it's expired orange juice",1643286940,hufj7lq,1,houkai3rd,2022-01-27T12:35:40Z
prettymotherfcker,Have you tried setting the timer on your coffee maker with no pot under it so that if you don’t wake up and move the pot you’ll have to clean up a huge mess?,1643286939,hufj7is,1,barstoolsports,2022-01-27T12:35:39Z
The_Event_Horizon_,"Homie, this is Reddit, not a scientific medical journal hahahahahahaha. 

I mean don’t believe me, it doesn’t bother me for you to think I’m right, why would I care about a random internet human caring if I was right? You won’t be a thought after my coffee son.",1643286933,hufj75x,1,dankmemes,2022-01-27T12:35:33Z
lucillep,"I can't help you with the iced coffee part, but a Keurig is a very, very convenient way to get a decent cup, especially if you are adding cream and sugar. I think you can get models that make up to 12 ounce cups, not sure about 16. If you want to test one out, there are always Keurigs at thrift stores like Goodwill for cheap, or search on Facebook Marketplace or Craigslist.  

r/coffee is pretty snobbish when it comes to pod coffee. But I have multiple coffee makers, and the one I go to on busy work mornings is definitely the Keurig. Aeropress, Clever, pour-over take too much time.",1643286903,hufj59v,1,keurig,2022-01-27T12:35:03Z
mick_au,"Driving while drunk is stupid, driving while enjoying a beer is fine in my view. I’m not talking about drinking until you’re over the limit, just a chill beer after work on those quiet backroads. Maybe two. How is that different to drinking a coffee or coke etc?",1643286899,hufj51p,1,australia,2022-01-27T12:34:59Z
faustinesesbois,Coffee with butter. Reallly works for me,1643286887,hufj49m,1,keto,2022-01-27T12:34:47Z
goldenstatriever," My husband and I are complete opposites when it comes to stimulants. Both Ritalin and coffee don’t do anything for him and I only have to think about caffeine and I’ll get all jittery. And after the effect of Ritalin subsided I’ll crash hard.

Every body is different and responds differently. I can advice decaf coffee. I am a avid coffee drinker but the caffeine just ruins me. So my normal might not be your normal.
For more neurotypical people it is possible that too much of caffeine intake will make its effect less.",1643286876,hufj3jl,1,ADHD,2022-01-27T12:34:36Z
vsuper2000,Remember his disaster on Seinfeld cars and coffee,1643286852,hufj22c,1,howardstern,2022-01-27T12:34:12Z
rinnip,First dates should be coffee only.  That's really pretty basic knowledge.,1643286836,hufj12x,1,AdviceAnimals,2022-01-27T12:33:56Z
Sijosha,You can also use your charging adapter to keep your coffee hot,1643286791,hufiya8,1,lifehacks,2022-01-27T12:33:11Z
Fisho087,"I had almost the exact same situation- old lady says explicitly that she doesn’t want milk and then complains there isn’t any when I hand her the coffee. I got in trouble with my boss, too",1643286790,hufiy6r,1,barista,2022-01-27T12:33:10Z
Difficult_Yak5398,Every morning tell her -pretend you’re an actor on set. Fake it to make it. Give her a kiss and make her coffee. Tell her anxiety is real but she is wonderful. Take it one day at a time. Every Friday celebrate the week. Discuss small victories.,1643286784,hufixuk,1,AskMen,2022-01-27T12:33:04Z
Little-Department715,Ngl that looks like iced coffee turned into ice cream,1643286780,hufixli,1,teenagers,2022-01-27T12:33:00Z
modeONE1,"I notice this especially on sport discussion shows. Inside the NBA with their big ass table looks so much better than before pandemic, where all the panelists look like they were sitting around a coffee table",1643286759,hufiwa7,1,tennis,2022-01-27T12:32:39Z
Hide_and_Seek_0193,Your talking what like half a coffee cup per person for thier entire life. Thats just a guess so dont quote me. Much better then burning fossil fuels then there is no future generation. Plus nuclear waste is often recycled and purified again or used for scientific research after it comes out of the reactor. They do the best they can. I've always thought we should launch it I to space after we're done with it. But maybe thats a bad idea.,1643286736,hufiuv5,1,JoeRogan,2022-01-27T12:32:16Z
DreamWildly,"This morning I was on a roll. Got up made the coffee got the kid up and moving. Then poured the coffee down the drain, rinsed the carafe and put it away. 

The celebrate part is that I keep cold brew in the fridge just in case executive dysfunction keeps me from making coffee some mornings. So I still have coffee today!",1643286724,hufiu52,1,ADHD,2022-01-27T12:32:04Z
king44,"I have a tip to up your lazyness game, if you don't care about 1.5 spoilers.

&gt;!The Hopper is available in Mr. Qi's Walnut room on Ginger Island. Basically, you set it behind a ""machine"" (keg, furnace, oil maker, etc.) and load it up with whatever the machine processes and it will automatically refill the machine whenever you harvest a finished item.!&lt;

&gt;!I had a ton of coffee beans saved up (like, 7000...), so I set up 3 hoppers with kegs in a spot on the farm I tend to pass by 3-5 times a day and filled them with my bean stash.!&lt; 

&gt;!Now I can grab 3 coffees whenever I happen to pass by, the hoppers refill the kegs for me, and there are 3 more when I pass by again an hour later. I usually end up getting ~9 a day. It's fairly passive coffee accumulation, and I love not having to interrupt my wine production to do a coffee kegging day every month or three.!&lt; 

Also, since you didn't mention it, the buffs for drinks stack on top of the buffs for food, so if you eat a food with a speed boost (i.e. Pepper Poppers, Crab Cakes) and also drink a coffee, you get a double speed boost. 

My farmer has a spicy breakfast every morning. :)",1643286723,hufiu3n,1,StardewValley,2022-01-27T12:32:03Z
canihazdabook,We're being asked for it at restaurants/coffee shops/venues/cinemas/gym... Well my gym is understaffed so there's nobody at the entrance very often but they're supposed to ask.,1643286691,hufis6k,1,TalesFromYourServer,2022-01-27T12:31:31Z
nofalvs,"This is pre-coffee, so please forgive my clunky responses.  I see your response downthread and think I can help with this question.  I wondered if I would start seeing ghosts more as I developed too.  The answer for me has been largely no.  I occasionally see spirits now, but mostly I feel them.  Developing my abilities caused a small uptick in clairvoyance, but that is all.  And you can always ask your guides to reduce the visuals for you if your experience differs from mine.  Hope that helps.",1643286685,hufirsz,1,Mediums,2022-01-27T12:31:25Z
LeopardProof2817,"Costco had coffee mate on offer, I bought 2 cans of it, it's took me 2 years to get through the first one. So I have powdered milk that's close to its BB date",1643286683,hufirp0,1,AskUK,2022-01-27T12:31:23Z
unusualj107,"To be honest, if all it takes is a bit of coffee to get someone to take their mask off and get sick then that's on them.",1643286679,hufirhj,1,Masks4All,2022-01-27T12:31:19Z
goldberrydreamer,"Coffee enhances your stress levels. Literally. So it doesn't give you energy, it only makes you more alert. So if you're already at a high stress level, drinking coffee will make you feel more tired, because you have too much adrenaline and that is exhausting. That's why exercise is a much better alternative: it decreases your adrenaline, resulting in you feeling more relaxed and more awake, not on surviving mode so to speak.",1643286670,hufiqyc,1,ADHD,2022-01-27T12:31:10Z
Keqingisthedpsqueen,coffee?,1643286668,hufiqu1,1,teenagers,2022-01-27T12:31:08Z
Interesting_Grape_87,Just chiming in that I used to think I couldn't drink black coffee but now I prefer it! Preferences can change!,1643286659,hufiqb5,1,intermittentfasting,2022-01-27T12:30:59Z
trieudat,"My partner and I have read two books together. A little marriage book club of sorts where it's just the two of us reading the book at the same time and doing weekly or monthly check ins. We pair our check ins with a ""date"" (long walk, coffee, dinner, etc) so we can talk about the book while enjoying an activity and each other's company. 

Here are the two books:
-8 Dates by John and Julie Gottman: https://www.gottman.com/eight-dates/
-Getting the Love You Want by Harville and Helen Hendrix: https://harvilleandhelen.com/books/getting-the-love-you-want/

Both books involve doing exercises together, which helps deepen the concept and learning. I'm always looking for more books like this so I hope there's more recommendations out there!

I've found that reading books on my own about repairing our relationship didn't help as much as reading books together. Good luck with this! Marriage is a lot of work, very hard at times, and having a great marriage is one of the best rewards one can have in life.",1643286643,hufipf9,1,workingmoms,2022-01-27T12:30:43Z
hamletandskull,Tell them that the Aeneid is fanfiction so my jjba giorno and mista 20k words slow burn coffee shop AU is an epic too and will last for thousands of years,1643286631,hufiopx,1,bookscirclejerk,2022-01-27T12:30:31Z
Ruadhan2300,"I have something similar sometimes, probably not to the same degree.  
I know I want the thing, I know I'll get a lot of use out of it, but the idea of dropping £1500 on something all at once is very uncomfortable regardless.  


That ""pulling the trigger"" block is a doozy.  


So I psych myself up, make sure there isn't a better option out there to make me regret this choice, and then push the button to buy.  


Then it's out of my hands, ""too late to change my mind"" (never mind that it's not too late until it arrives and is unpacked)  
I find that gets me over the hump and I can be comfortable with my purchase after that.  


Part of my set of tools for psyching myself up on big non-essential purchases is to ask myself how long it's going to be used for.  


A high-performance gaming PC has an operational lifespan between four and eight years depending on how you treat it, how intensive the games you play are, and the vagaries of random chance.  
My current machine is towards the end of that lifespan and showing signs of age, with lower performance and sluggish behaviour, so your exact problems is likely to rear its head for me before too long.  


Regardless, A six-year lifespan for a computer that's going to cost £3000 is a fairly reasonable £500 a year.  
Or £1.37 a day.  


I went through a period of my life where I spent more than that on coffee.  
You probably spend more than that on streaming services or subscriptions.  


Frame it that way, maybe you'll feel better about it.",1643286607,hufin6s,1,UKPersonalFinance,2022-01-27T12:30:07Z
GerraldTMS,They cancelled some dude because he promoted coffee with butter?,1643286591,hufim8g,1,JoeRogan,2022-01-27T12:29:51Z
Efficient-Book-3560,"You’re in my fucking coffee shop now, pal. You will Follow my protocol or you will not get a smile from me, mother fucker. You will not say large, it is a fucking venti. And if you don’t say please, the way I like, then you will pay more … asshole.",1643286581,hufilnu,1,mildlyinfuriating,2022-01-27T12:29:41Z
Just1biteplz,"Which ones are you familiar with if you don't mind sharing? I've been to 3 in the twin cities, Midway Books, Subtext and one other which I currently can't remember, in St. Anthony, but I posted it here. But if you're ever in St. Paul, check them out. Especially Midway Books. It's huge, I wanted to find a big fat chair and grab a pile of books, a coffee, a snack and just stay forever 😄😁",1643286569,hufikzd,1,bookshelf,2022-01-27T12:29:29Z
TheFamousHesham,"Stage 1: Coffee
Stage 2: Caffeine Tablets
Stage 3: Modafinil
Stage 4: Amphetamines
Stage 5: Cocaine",1643286565,hufikpr,1,TooAfraidToAsk,2022-01-27T12:29:25Z
a_reasonable_responz,"So your reason for not wanting a booster is that it’s a waste of time, that it won’t actually help you or the the pandemic. So you can’t be bothered with it, but you’re frustrated that if you don’t get it then you’ll be locked out of activities/access to things.

Firstly it’s suspect that you mention going outdoors or CO2 meters as alternatives. Fresh air and being outdoors won’t help you not get covid, not spread covid or recover from covid. And co2 meters might help you know if it’s time to go to the hospital if you have covid. Categorizing them as permanent things that help is just ridiculous.

Fact is that a booster will help you clear covid faster which means less time being infectious, during which you could pass it on to someone who might get really sick. 

That is reason enough to get a booster and a reason why it’s effectively mandated through passports. But not just because people getting really sick is bad, but because less people infectious for less time will reduce the spread, reducing the risk on overloading hospitals, which reduces the need to implement stricter countermeasures, which results in less impact on the economy. So the coffee shop you like can stay in business.",1643286543,hufije0,1,changemyview,2022-01-27T12:29:03Z
0left415,"Hippie speedball! That is the key my man. 

I like to think of my self as a pretty high functioning stoner, I smoke daily and often in the morning, hold down a pretty demanding career with long hours, my day starts at 7am and end around 6pm but I get amazing sleep due to the amount of weed I smoke so it’s all good. Lol 

I usually snap my first bowl between 5-6 am, just a small  one, probably less than 5 points. Walk my dog and have some coffee (cannabis + caffeine 😉). Snap another small bowl before hitting the shower and I’m good for the day. When I smoke before work or during work I get hyper focused which makes me more productive, but I work in software where I need uninterrupted focus most of the time. I’m naturally a bit scattered and my mind jumps around topics quickly making focus a luxury I don’t usually have - if I have meetings I won’t smoke before work otherwise I’ll be stuck trying to dissect the agenda for the next hour lol 😂 

On the weekends and evenings is where I really consume. I switch between indica dominates and sativa dominates, weekends being mainly sativa + caffeine so I stay productive and evenings are for the indicas.",1643286535,hufiix8,1,weed,2022-01-27T12:28:55Z
rifleman209,Coffee,1643286517,hufihvd,1,AskReddit,2022-01-27T12:28:37Z
creationscaplette,"That's how I roast my beans 😂 /a

No it's definitely not for coffee 😊",1643286481,hufifrl,1,espresso,2022-01-27T12:28:01Z
Ieatalot2004,"We did sell coffee, but nobody ordered it, because we were a fast food place. One time, a woman did. At first, it surprised her that we did not have a price for coffee. Because why price something you never sell? Then, she was surprised we did not have cookies with it. We did not have cookies because we sell fries, deep fried meats and ice cream.   
She proceeded to whine about it the whole time. ""It's cold outside, i was looking forward to a cookie."" ""We do not have any."" ""I was expecting you to."" ""We are sorry, ma'am. You are our first coffee order in the existence of this restaurant."" ""A cookie would have been nice.""",1643286467,hufiez9,1,AskReddit,2022-01-27T12:27:47Z
gagrushenka,"I did my undergrad linguistics research project on the impact of hearing impairment in court. Basically there's an optimum timing for responding without appearing guilty but if you can't hear well you are likely to miss that window. And if you're guessing what you missed and your response doesn't sound quite right, it can come across as being deliberately obtuse, etc,  even if everyone present is well aware that you don't hear well. The mechanics and rules of conversation are so ingrained in us that we struggle to overlook them even when we acknowledge there's a perfectly good reason for it to not go smoothly.   So while maybe you meant barista here, barristers certainly ask questions and the stakes are perhaps a bit more dire than getting the wrong coffee (which is usually not a good start to the morning).",1643286463,hufierg,1,AskReddit,2022-01-27T12:27:43Z
Marshall_Lawson,"&gt; Also it will brake if someone inches toward your lane and grazes the lane marker, even if they don't merge. 

Yeah, just yesterday I was on the highway and there was a Tesla cruising in the left lane, this is one of the areas where the speed limit is 55 but everyone goes 70, when it was pretty open the tesla was ""at speed"" with everyone else, but there was this concrete wall on the left (No left shoulder) and the tesla was cruising right behind the blind spot of a dump truck, whenever it got close between the truck and the wall it would slow down to like 60. Eventually I just waited for an opening between the tesla and the truck and jumped in front of the Tesla like an asshole. I hope I made the driver spill their coffee.

&gt; Every car I know of has blind spot monitors.

yeah they are called mirrors 😉",1643286458,hufieft,1,cars,2022-01-27T12:27:38Z
robotcrackle,"NTA, I work in a coffee shop too and still know tipping isn't an obligation. Jane was just being racist for internet clout. I'm proud you stood up for your mom and asked Jane to take it down. Its fuqked up that she refused and doubled down by making herself the ""victim"".

If the video she made is still up, you could copy it and post it to your FB to explain your side. But it may not do anything positive for you. I'm sorry this happened to you guys.",1643286452,hufie1t,1,AmItheAsshole,2022-01-27T12:27:32Z
RaelImperial31,"Todd Young would sell his soul just for a cup of coffee, seriously, we have to have better federal representation than him and Mike Braun",1643286449,hufidum,1,Indiana,2022-01-27T12:27:29Z
oldbenja,A really nice coffee machine lol,1643286418,hufic07,1,conspiracy,2022-01-27T12:26:58Z
Kirsham,"&gt;i like nice black coffee and ~~creamy sweet coffee~~ dessert

riposte",1643286412,hufibl3,1,questionablecontent,2022-01-27T12:26:52Z
dehydratedrain,"Hate to say it because I've been there, but YTA. She has an incredibly stressful job, and at the end of the day it relieves a lot of stress to have someone to vent to. 



And what makes if even harder is that she is in a position where many people depend on her, so walking away will cause massive guilt to anyone that doesn't have a rock for a heart. (I say this assuming she makes arrangements to transport patients to/ from scheduled appointments, but if it's emergency transport, even more so). By banning her from work chat, she becomes even more stressed from keeping it inside or she may even look for other people to talk to and view you as mean or controlling. 


Now look at it from her perspective. Vacation days may just mean a day to relax, so coming in is just an excuse to finish the work she left behind. She is not wrong in believing that being productive is better than staying in bed (for most people, not her). So encourage her to do stuff on one of her days off. A pedicure. A movie. A good coffee out of the house. Something that gets her away from laying in bed being okay with a call to come in. 


Then be more proactive in asking her how her day was and giving her a few minutes to share what happens. Also encourage her to write it down in a journal or text, so she can recognize patterns of her boss abusing her ability to come in. And then listen to her even if you don't focus on every word. She needs this for her mental health and she'll remember it for years.",1643286411,hufibif,1,AmItheAsshole,2022-01-27T12:26:51Z
roxadox,"Visited USC Petrie campus last year, it's gorgeous. I sat on the massive steps, ate a quesadilla and drank coffee from their cafe and watched the Olympics on their huge screen. Very cool space.",1643286379,hufi9kv,1,brisbane,2022-01-27T12:26:19Z
