author,body,created_utc,id,score,subreddit,created_datetime
coookiesncream,"Kapag may GERD

* Avoid citrus and spicy food
* Iwasan din ang carbonated drinks and coffee, even chocolate
* Huwag hihiga agad pagkatapos kumain. Wait 2-3 hrs after dinner bago matulog (ako 1 and a half lang since I only eat small portion ng food every meal)
* Elavate mo yung pillow pag matutulog ka.
* As much as possible, iwasan ang fried and greasy food.",1643278795,huf7kgl,1,Philippines,2022-01-27T10:19:55Z
Throwawaytilitsdone1,That goes without saying.  There is no life before coffee. :),1643278747,huf7iam,1,freeusefamily,2022-01-27T10:19:07Z
beeeeeeeeeeeeeagle,"I can't exercise on an empty stomach. When I use to do a 530 AM work out I'd hit a black coffee, banana and muesli bar. All light and easy to digest so even if I was doing cardio it wouldn't make me feel sick. Empty stomach is no good for me. Makes me feel weak and anxious.",1643278685,huf7fhz,1,bodyweightfitness,2022-01-27T10:18:05Z
SacaredCover,"I had covid last week and while I didn’t experience what you have described here (drinking coffee helped with my covid throat) I did when I had strep throat 3 years ago. Every 2 seconds I had to cycle the saliva in my mouth which felt like I was swallowing shards of glass, I constantly felt like I was on fire. It was so bad after 3 weeks of antibiotics I had to get steroids as well.

One thing that helped that’s not a common one, cepacaine. You can get it from a pharmacy on the shelf, it numbs your mouth like the dentist injections do, it’s absurd how strong it is. Also try gargling dissolvable Panadol, short relief but can be worth it.",1643278678,huf7f7c,1,melbourne,2022-01-27T10:17:58Z
Titimoc,Haven't you noticed this is a cult? A cup of coffee and it will kill a zero. lmao,1643278595,huf7bht,1,SaitamaInu_Official,2022-01-27T10:16:35Z
AlexArdelean112,Has anyone ever told you that their  nespresso machine makes better coffee than the setup you worked so hard to put together? 🙂🙂,1643278566,huf7a93,1,espresso,2022-01-27T10:16:06Z
CookiesCaffe,"I’m not familiar with that specific coffee, but my guess would be that it is a blend consisting of both washed and natural processed coffees. There is a semi-washed process (sometimes called a wet-hulled process), but I’ve never heard that be called “natural, washed”.",1643278559,huf79yc,1,Coffee,2022-01-27T10:15:59Z
clarroo,my business partner has some health issues which mean she needs to eat before taking her meds so over the years we've spent a lot of time sitting in cafes or tearoom with me nursing a black coffee (because they never have non-diary options) and her wolfing a sandwich she doens't really want so she can take her medication (not to be taken on am empty stomach,1643278510,huf77qc,1,JUSTNOMIL,2022-01-27T10:15:10Z
kaisercisco,"Also, did you catch the nod to Twin Peaks in episode 9 of new blood when he claimed he was going to take a ""damn fine cup of coffee?""",1643278506,huf77jf,1,Dexter,2022-01-27T10:15:06Z
ruinawish,"Yeah, I don't get the 'shower to wake up' logic. A nice hot shower is likely to make me less alert. Just splash your face with cold water if you want to wake up. Having a coffee also helps.",1643278480,huf76d5,1,melbourne,2022-01-27T10:14:40Z
BlissBlissBliss,100% agree with the all time low one. Could start with coffee shop there too. what an amazing album that is,1643278467,huf75s7,1,poppunkers,2022-01-27T10:14:27Z
SLCW718,Isn't the Queen Soopers on 9th by the Daz Bog coffee shop?,1643278431,huf745z,1,Denver,2022-01-27T10:13:51Z
ambigrammer,"Lol... we are having fun in the current news cycle, aren't we?

btw, awesome skills. I am on month 1 yet. Have progressed from pouring blobs to pouring butt-like shapes. If I can manage something close to what you have in 6 months, I will be amazed.

Question - do you practice at all? I basically try my best 2 cups a day, and can't get any more practice than that. Neither do I want to waste coffee and milk. Nor do I have time to keep pulling shots-steaming milk repeatedly.",1643278424,huf73vr,1,latteart,2022-01-27T10:13:44Z
syl-lo,"I did exactly this and I’m getting much closer to a normal shot. I lowered the internal grind settings from 6 to 4, however I’m between 1/30 to 3/30 on the display settings so I might lower the internal setting further.

Either my machine grinds very coarse by default or the coffee I’m using needs to be very finely ground, either way thank you for your advice ! 

I’ll post an update once I get a “perfect” shot :)",1643278391,huf72et,1,espresso,2022-01-27T10:13:11Z
DCpAradoX,*There's coffee in that* `cosplay`,1643278359,huf70zn,1,cosplaygirls,2022-01-27T10:12:39Z
bearymiller_,"First thing I do when I wake up is drink water. Then I’ll take a shower, take my vitamins have a piece of fruit (usually banana) and either go from a walk or go to the gym. On the way home I’ll grab a coffee and When I get back I’ll take another shower then prepare/eat breakfast, tidy up and then I usually have a little bit of time where I’ll generally read or just laze around until I start work.",1643278329,huf6zqo,1,getdisciplined,2022-01-27T10:12:09Z
DontDeadOpen,"Never, but I made sure to add something to my CV directly. Even if I was unemployed for half a year I made something up for what ever hobby I was in to atm: “Project manager, Pedagogical Boardgame developed.”

I’m doing my PhD and teach at the university with good benefits. Not making a lot of green but definitely a better future prospect than working under some boomer who can’t even convert into PDF who tells you to run and make some coffee, “pronto”.",1643278295,huf6y9d,1,lostgeneration,2022-01-27T10:11:35Z
bitesizeconsistency,"Do you post here with a different account every few days or something?

Have you ever actually tried to attract someone? I'll tell you what, spend 1 year going out and meeting as many people as you can, if there's a girl you like just ask her to have a coffee with you. If after 1 year you still don't have a girlfriend then come back here and ask for advice.",1643278267,huf6x1z,1,selfimprovement,2022-01-27T10:11:07Z
st3636,"Lets pretend you were a barlady and were in a LTR with a boy who ignores you and, sometimes, even insults you/hits you. But... You still love him somehow.

One day, a seemingly single and lonely guy with nice looks and manly attitude shows up in your place, and from now on he starts simping you systematically (things such as gifting you a coffee, complimenting you about your cheerful behaviour), as if he somehow understood you were already taken yet tried to win your heart.
He's always buying something and trying to have a chat with you, he leaves you alone only if you're busy.

You get to know he behaves like that with other people too. He sometimes complains he can't seem to find a girl that is not already taken.
You also get to know he already asked out one of your colleagues and got rejected due to her being already in a relationship.

How would you act if that kept going on for months? Mind you, no creepy/stalkerish behaviour at all, as if that guy knows the law and is deliberately trying to make this go on as long as possible until he gets what he wants?

He doesn't seem obsessioned in you, rather obsessioned in the idea of having a girlfriend. He's always gentle and respectful, he always act confident and never ever sexually desperate. He's basically hell bent in getting to be more than a friend for a girl.

Would you perhaps try to hook him up with one of your single friends, eventually?

Thank you",1643278264,huf6wxy,1,virgin,2022-01-27T10:11:04Z
illtellyahowimdoing,I’ll drink any coffee but really like the one at Maman,1643278245,huf6w3l,1,AskNYC,2022-01-27T10:10:45Z
TheSpanishPrisoner,Don't ever drink coffee at a coffee shop? Like never? That's good advice?,1643278205,huf6udo,1,conspiracy,2022-01-27T10:10:05Z
Kindly_Region,One smol coffee pwease uwu,1643278122,huf6que,1,clevercomebacks,2022-01-27T10:08:42Z
Billywizzer2021,"I met my wife via match.com.
I was just coming up to 60 at the time.
We firstly exchanged emails.
Then spoke on the phone every evening. 
This was to find out if we were compatible as there was no point in meeting someone if you have nothing in common. 
When we finally met up fir coffee we had already built up a relationship. 
We have been married now for 9 years. 
I from previous attempts found if you jump straight in with a date you are skipping the building stage of a relationship.
But good luck but just remember you have to kiss a lot of frogs to find your prince.",1643278117,huf6qm9,1,datingoverforty,2022-01-27T10:08:37Z
rhinoceroschimpanzee,"The milk will be dominant, as filter coffee is less strong.",1643278079,huf6oy0,1,espresso,2022-01-27T10:07:59Z
Interesting-Gear-819,"&gt;That was when I realized how easy it is to get addicted. 

I really urge anyone out there who drinks coffee. ""Because you always did it"" or ""everyone else does it"". Try drinking not a single cup for 2-3 days. No other products with caffeine either obviously and don't break your normal circle. Not drinking coffee on weekends is a different thing ...

  
If you feel (slightly) shitty just because of the lack of your coffee. Imagine it a hundred times worse when you are addicted to e.g. Heroin. Addiction doesn't have to happen ""suddenly"" but can also come slowly, over time. Some fall easier for it, others struggle less but nobody is immune, that's how we work.

&amp;#x200B;

Or in other words. If you circuit a rats brain to a button, so that a button press will trigger an orgasm. Then the chances are very good that the rat will keep pressing that button and starve while doing so.",1643278026,huf6mip,1,AskReddit,2022-01-27T10:07:06Z
ButtholeSoup,That coffee aisle is dangerous,1643277970,huf6jz2,1,cincinnati,2022-01-27T10:06:10Z
the_pianist91,"A traditional cappuccino is to contain three equal parts of coffee, milk and foam according to the Italian Espresso Institute. You don’t get a third part of foam with *that* foam.",1643277963,huf6jou,1,espresso,2022-01-27T10:06:03Z
mr_kazemiro,"Dos:

* Pay in dollars (the Colombian peso is devaluated)
* Pay the salary on time (ALWAYS)
* Offer remote work + possible coworking spaces (If possible)
* Give at least 15 days of paid holidays (15 days are mandatory)
* Respect the 8-hours schedules. If necessary, there are regulations for extra-hours and Sunday hours
* Offer bonuses for taking certifications, e.g. AWS, Scrum...
* Always say 'hi' to every single employee as you want to be greeted
* Get involved in conversations. Coffee chats may encourage good relations. Notice, coffee is super important for us.
* Encourage teamwork
* Afterwork beer on Fridays are a thing, take the initiative to invite your employees
* Colombia is a diverse country. You may work with people of all shapes, colours, genders. Enjoy diversity.
* Be aware, there are certain events that everyone wants to attend. For example, when the national football team plays.
* Try to provide the instructions as explicitly as possible, and always write them.

Don'ts:

* Never miss a salary payment (like NEVER)
* Nobody cares about Christmas or integration parties, save that money to ensure nice working conditions
* Never encourage competition among colleagues
* Never do illegal contracts, there are harsh consequences. E.g. hiring someone without EPS/ARL.

In general, Colombian developers are high-quality coders. Hope you will enjoy your experience as a manager.",1643277960,huf6jj1,1,Colombia,2022-01-27T10:06:00Z
Aptekafuck,"I make black coffee like two table spons of coffee to one and a half cup of water (this is like weak coffee for my Brazilian standards, we drink really strong coffee), then when I do not want to add sugar which is pretty much always then I mix until it is almost cold so like I can drink it fast and will not feel the taste that much.",1643277932,huf6i9f,1,EDAnonymous,2022-01-27T10:05:32Z
_rickjames,Time for a coffee,1643277921,huf6hrd,1,ukpolitics,2022-01-27T10:05:21Z
Amilo159,"This is wrong on all levels.
First, even assuming that it's taking about instant coffee, which really isn't anywhere ""professional"" coffee.. you never use boiling water.

Coffee water should be between 80-86 degrees Celsius, (about 180-186 Fahrenheit).",1643277910,huf6had,1,mildlyinteresting,2022-01-27T10:05:10Z
darlene_yquel,"&gt;!Militsa. The coffee scene somewhere, her necromancy bracelet and shes a teacher!&lt;",1643277905,huf6h0y,1,skulduggerypleasant,2022-01-27T10:05:05Z
DnANZ,"How much do you think is ""enough money""?

If you live to the average life expectancy of 80, and you inherit $1 million now at age 25, that's going to be $15k to spend a year.

$15k a year is enough for food and the latest iPhone. Unless you live for yourself for 60 years, add in a few children and assume the wife works. 15k a year is nothing.

$1 million is a crazy amount in your 20s. Go on a nice 4 week holiday, save or invest $950k.

I'm 34 and have saved up 400k living simply and focusing on work. I'm still ""young"" but all of a sudden I can finally travel and have a steady source of passive income. $100 a week. It's not much, but I like to think it covers my coffee money for the rest of my life. Have a kid now. Married.",1643277843,huf6ecd,1,SelfAwarewolves,2022-01-27T10:04:03Z
Crackforchildren,"Interesting, in Vietnam it's also called coffee money. But with the amount you'll end up paying they're getting alot more than coffee",1643277832,huf6dtc,1,worldnews,2022-01-27T10:03:52Z
moldybuttcheese,"I agree, it definitely was a lot of work to get all of this done and on the plate. I'm going to keep looking at the dish and simplify it down. I'm thinking of getting rid of the coffee caramel glaze and replacing it with orange glaze. Then, instead of having a faux egg (which I did by accident, but by the time I had it plated I was determined to finish it lol) maybe do a molded and formed filled mousse. I also think moving the ice cream to the side of the tart would help in showcasing the tart as the focal point, and instead of decorating the whole tart, maybe just decorate the edges. Or maybe I get rid of the ice cream all together. I'm definitely going to keep working on this recipe, I appreciate the feedback!",1643277831,huf6drk,1,CulinaryPlating,2022-01-27T10:03:51Z
outrideacrisis,"I woke up feeling like is had a great sleep, and then realised I've done my back in whilst sleeping again.

Full day of sitting awkwardly perfectly upright and pain from lifting my coffee mug for me.",1643277763,huf6asm,1,CasualUK,2022-01-27T10:02:43Z
ADB225,"Thks..just spit coffee out my nose.  
P.S. Damn it, I have no award to give ya either.",1643277722,huf68yo,1,londonontario,2022-01-27T10:02:02Z
Mistressbrindello,Or you can try calorie free herb tea like peppermint. I like having a hot drink to sip and found even a cup of hot water was fine for me. Coffee isn't compulsory if you don't like it,1643277717,huf68rh,1,intermittentfasting,2022-01-27T10:01:57Z
Chimp-eh,"Work me is a miserable bastard 

Home me is a miserable bastard with good coffee",1643277637,huf656i,1,AskUK,2022-01-27T10:00:37Z
Spellcheck-Gaming,Yep. Not even had my coffee yet and today has already been too much for me haha,1643277619,huf64c0,1,collapse,2022-01-27T10:00:19Z
HelloKitty36911,Surely if you just like coffee less caffeine is better since caffeine is unhealthy right?,1643277606,huf63ta,1,Tinder,2022-01-27T10:00:06Z
knatehaul,I just spit out my coffee.,1643277580,huf62mn,1,science,2022-01-27T09:59:40Z
seattle_exile,"In the theater, Thor drank the coffee, smashed the cup and yelled, “I like this drink. **Wench**, bring me another!” They have subsequently removed that word.",1643277567,huf621e,1,conspiracy,2022-01-27T09:59:27Z
Pyrrylanion,"&gt;	How about removing the option of having plastic bags available whether chargeable or otherwise, like how fast food restaurants don’t have straws? I usually bring a trolley for intentional grocery trips, or have items put in my backpack for on-the-way grocery trips.

Forgot to bring bag or you accidentally buy too much, then how? Buy an extra reusable bag that you don’t need (or two) and raise the carbon footprint even more and needlessly too?

Straws are not a necessity. No straw, drink from cup. No problem. Reducing something that is not needed is perfectly fine.

But, no bag use what? Stuff inside your shirt and underwear?

Might as well say ban disposable plastic cups or drink bags too, so next time if you forgot to bring your hot water flask when you dabao your kopi O, the auntie will just pour hot coffee down your throat.",1643277567,huf6216,1,singapore,2022-01-27T09:59:27Z
YoungMoroseGentleman,"I greet thee with greatly, with pleasest of askings could thou serve me a coffee of rather small size?",1643277559,huf61m8,1,mildlyinfuriating,2022-01-27T09:59:19Z
evergreen1476,"Right away, he was living in a hostel and our dates would be 5 days each time. I felt like a new person when he was around. He always was caring and helping me... I had my dishwasher broken and he brought his tools to repair it... I had a cold and he prepared a soup and got me medicines. He prepared the coffee and washed the dishes, he is super clean and likes tidying up staff... Super zen personality that just calms me. When he is there my demons are gone, he hugs me, kisses me, tells me I'm beautiful and helps me with the house... I asked him if he wanted to stay for a weekend I was not there, but he refused, he respects this is my space and my flat. 

Finally, he could not get to the hostel because he didn't have the vaccine back then, he wrote me that he didn't have where to go and if he could stay at my place while he finds somewhere to live. We have been living for 3 months together now and it's amazing, 0 conflicts, we are both very clean and like cooking, so we just get when the other wants to cook or so. I learned about how creative he is and it feels awesome having someone to kiss and hug every day.",1643277557,huf61ko,1,AskWomen,2022-01-27T09:59:17Z
nametab23,"&gt;Main/honest answer first - because I only vaguely recall metadata legislation happening, must or have caught my attention whereas a QR code is hard to miss.

Thank you for being honest about this element. I was literally shut down my 3 people on Facebook at the time of metadata retention, who bought into the anti-terrorism rhetoric and said *'if you've got nothing to hide, you shouldn't be worried'*. 

They're ex-colleagues + very extended family.. Not close social circle. However you can imagine how ironic I found it that those same people are now 'outraged' by QR codes and the 'invasion of privacy'. 


&gt;Small additional thought - metadata may link you to a certain tower at a certain time, but it doesn't show whether you were in a strip club or the coffee shop around the corner.

I would suggest you investigate what can be derived or obtained through metadata, before following that thought.",1643277535,huf60l9,1,CoronavirusDownunder,2022-01-27T09:58:55Z
