author,body,created_utc,id,score,subreddit,created_datetime
Karr_H,"When I first started at hotels, the person training me pointed out the panic button...

&amp;#x200B;

Then said it does indeed work, as she had brought her son to work one snow day, and he ran around pushing it several times.

The police did come.

I also had the police come once, as we had a panic button that hung on the back of the office door... The only that opened to the lobby. Some homeless guy thought it was important, or valuable or something and took it while I was making coffee... Then pressed it.

Cops made me go outside to meet them, just to prove I wasn't being held at gun point from behind the counter.",1643289377,hufnp3o,1,TalesFromTheFrontDesk,2022-01-27T13:16:17Z
Agnosticpagan,"Most trades are one asset to another. Money is just the clearing account for most the transaction. ForEx is purely monetary transactions, but the majority of that are short-term hedges against long-term contracts of an underlying asset (oil, wheat, steel, coffee, etc.)

I agree that capitalism is predicted on infinite growth, and thus unsustainable. Ironically, most bankers get that since they deal in credit far more than currency, and unlimited credit is not a good thing. The rest of finance? 'Stonks always go up!', until of course they don't.",1643289373,hufnou4,1,CriticalTheory,2022-01-27T13:16:13Z
eyecouldbeyou,"I don't have any advice to give you other than to say I feel your pain. My buddy that I have known practically all my life has a big (huge...about 9 inches as well) one and he always.....I mean ALWAYS.....hooks up with different women. 

Some of these women are even married and they tell him how her husband is not even half his size. As a friend I give him high five every time he gets laid but deep down inside I get this knot in my stomach. 

Being that I am only average in size I could be the guy where my wife cheats on me. Women always claim ""size doesn't matter"" (especially here on reddit) but I haven't met ANY of these women in real life. I hear it all the time how they say it does matter whether at work or a bar or over hearing women at a damn coffee shop (true story). 

Maybe it's the women I go for that say it matters. Yes I am a good looking man that wants a good looking girl. If anything it's the girls that aren't my type that maybe say size doesn't matter but these are girls that I wouldn't be able to get erect to. You understand what I mean?

Not only does he get constantly laid for his size but he also has had it good all his life. He doesn't know how it feels to struggle financially (like me). Things always seem to fall on his lap whereas I need to work hard to get a little something.

I've learned that some people just have it and some don't. Maybe in my previous life I was a porn star with a huge cock and tons of money or maybe it will be in my next life 🤷‍♂️ but in this life not so much.

I feel you bro ✊",1643289367,hufnoe2,1,DirtyConfession,2022-01-27T13:16:07Z
Gr1pp717,"If coffee and food is the reason you lack the literal tens of thousands needed to survive that's not a ""you"" problem...",1643289356,hufnnla,1,conspiracy,2022-01-27T13:15:56Z
Playful-Example7201,"They’d have to be crazy to complain…I’d ask if I could join you, I’ll being coffee ☕️😘",1643289343,hufnmq4,1,OutdoorRecreation,2022-01-27T13:15:43Z
friskpocolypse,"""Thank you! I love coffee!""",1643289331,hufnlui,1,FlowerFellAcademy,2022-01-27T13:15:31Z
Realistic_Side_1499,"Idk, for some people it's enough with coffee before work. But coke might work as well",1643289325,hufnle7,1,Drugs,2022-01-27T13:15:25Z
spicygay21,"i make coffee drinks at McDonald's which doesn't count but i had someone order a small coffee with 13 sugars and 4 pumps of vanilla, but halfway diluted with water.",1643289316,hufnkqv,1,AskReddit,2022-01-27T13:15:16Z
BigArnie02,I think experiencing some of the side effects of being addicted to caffeine (with one of them being heart palpatations) motivated me to cut down. My health is much more important than drinking a lot of coffee.,1643289315,hufnkpw,1,AskReddit,2022-01-27T13:15:15Z
IsItABedroom,[Best local third wave coffee (cafes in Manhattan)?](https://www.reddit.com/r/AskNYC/comments/s2gexq/best_local_third_wave_coffee_cafes_in_manhattan/) from 15 days ago recommends St Kilda and Sey Coffee among others. [What's the best coffee place in lower Manhattan?](https://www.reddit.com/r/AskNYC/comments/q4d9lh/whats_the_best_coffee_place_in_lower_manhattan/) from 4 months before that recommends Abraco and Laughing Man Cafe among others.,1643289311,hufnkdh,1,AskNYC,2022-01-27T13:15:11Z
unaalpacafeliz,"Yes! Thanks ❤️ 

I love my objects. I’m kind of fan of pots. The ones on the pic are to make latte art. And the other coffee pots are from a brand called La Cafetiere. I also use them  for tea. They are thermic are keep the liquids hot for long hours.

And the glasses are from a French brand called Duralex. Are meant to be unbreakable, can confirm.",1643289309,hufnk8q,1,HilariaBaldwin,2022-01-27T13:15:09Z
poopy__bunghole,I'm used to the filter coffee from by2coffee or udupi hotel or an espresso from the coffee dispenser that too once in a while because I didn't want to get used to caffeine. I expected the prices to be more but filter coffee and 180 bucks seemed high imo considering the quantity,1643289283,hufni9v,1,unitedstatesofindia,2022-01-27T13:14:43Z
zbeezle,"Man, wouldn't it be awesome if coffee tasted as good as it smells?

I keep telling myself I'm gonna go shooting, and then a day comes around and I find something else to do. Why?",1643289279,hufni1o,1,guns,2022-01-27T13:14:39Z
kayella69,"Just plop a big soaker tub under the artwork and I may never leave… I even succumbed to table art for this one, even though no one needs vases in the middle of the bathroom counter, because I felt like it helped pull some of the colors together. I’m probably just groggy because I haven’t had my coffee yet - lol.",1643289272,hufnhiq,1,RedecorHomeDesignGame,2022-01-27T13:14:32Z
Just_Learned_This,"I will say, the stories I hear are crazier than the ones I've had happen to me working at a bar. Morning shift is cake. Bunch of people who aren't awake just in for their coffee and cigarettes.",1643289261,hufngoi,1,WorkReform,2022-01-27T13:14:21Z
Medium-Inevitable-52,"You’ll only change when you decide to. Honestly. I started cold turkey one day and it worked for me then but after the holidays its been sooo hard mentally to get out of that habit. So then I decided to try slowly. I cut out my favourite treats and let myself have sugar with my coffee in chocolate protein milkshake form. Now that’s getting to be gross to me so I’m gonna cut it out completely. 
The first three days are the hardest because your body is fighting you, after that it’s much smoother and it’s absolutely amazing to go through your day without moodswings or afternoon energy crashes. 👌🏼 Also, if you throw in intermittent fasting it helps a lot too, because you’re not tempted to snack. Snacking I found always makes my cravings 10x worse.",1643289260,hufnglu,1,sugarfree,2022-01-27T13:14:20Z
fkdkshufidsgdsk,"biggest piece of advice is to really preheat that brew chamber -put it in a silicon funnel in your kettle, cover it and leave it in there while the water boils and let it sit in there with the water boiling for a couple mins before you pull the shot. The pro takes longer to heat up than other models (but also holds its heat the best) My first shots I just followed the preheat instructions that came w the flair and the coffee came out tasting like battery acid lol.

also, get a WDT tool. I have a jx pro so ill assume the max is similar in that it clumps quite a bit, just kinda the nature of a conical hand grinder. WDT completely eliminates channeling for me, before even when I felt like my puck prep was perfect, I could get a spurt shooting out.

dialing in is fun! once you have your routine down its really not that tricky and takes less time start to finish than most semi autos where you need to preheat the machine for 15-30 mins",1643289258,hufngir,1,FlairEspresso,2022-01-27T13:14:18Z
GSSD,"Mid 3's for a monthly allowance is not an allowance, it is coffee money.  You are basically vanilla dating this guy. Leave him immediately unless you like vanilla dating him.",1643289256,hufngb9,1,sugarlifestyleforum,2022-01-27T13:14:16Z
zbeezle,"Man, wouldn't it be awesome if coffee tasted as good as it smells?

I keep telling myself I'm gonna go shooting, and then a day comes around and I find something else to do. Why?",1643289253,hufng45,1,guns,2022-01-27T13:14:13Z
zbeezle,"Man, wouldn't it be awesome if coffee tasted as good as it smells?

I keep telling myself I'm gonna go shooting, and then a day comes around and I find something else to do. Why?",1643289249,hufnfrh,1,guns,2022-01-27T13:14:09Z
hva5hiaa,"With my prescription medication, I still 'want' to be asleep during the day. It just helps me push it off to the side. It is always looming and if I were to shut my eyes too long, I'd want to find a place to take a nap. There are researcher who think that hypersomnia patients are like gas/brake pedal. Normally you let up on the brake, step on the gas (medication/ stimulants/ adrenaline) and you rev your system up. When you step on the brake (calming down/ medication/ depressants) your heart rate slows, thoughts stop racing. With hypersomnia, the brake pedal is stuck. You can step on the gas, but you won't get anywhere fast. Thus I am 'awake' (not necessarily 'alert and normal')  and 'very sleepy' at the same time.

Medications can be chosen due how long they can stay in your system during the day, or formulated with time release so they keep your blood concentration up. Modafinil, for instance has a biological half life of 13 hours - ie 13 hours after taking it, half the concentration is still working in your body. The substances you mention have much shorter biological half lives, so the effects are too short to keep you awake as easily, even though you might still be feeling other effects. Everything, like caffeine, is the same - coffee drinkers titrate their blood levels by getting more throughout the day or else they get a 'crash.'

Alcohol has 'biphasic' effects - initially being excitatory, but then sedative. That's hard to keep at the right level and also not have the other affects of alcohol interfere with your daily activities. 

It is possible your metabolism is 'fast' as you mention, too. That half-life number can vary by hours, if your liver enzymes are better/ more of them at breaking down certain molecules. I can't take codeine as a medication - I still have great pain on a normal dose and family members with the same gene just get side effects and not relief. 

And of course, we're just random people on the internet, and not doctors. There are a lot of conditions which include excessive daytime sleepiness. It took months of blood tests, MRI, CT scans, spinal taps, psychologists, sleep tests, etc before tagging me with hypersomnia. My quality of life was so bad I was actually crushed when I was told that the Neurological Grand Rounds at Johns Hopkins said that semi-experimental brain surgery on a odd spot in my brain wouldn't help my sleepiness. It could be your problem is easier to fix, so I hope you are able to find a specialist who will really take the time to listen to you and help. 

It took three different medications to get me to the level of 'feeling like it is always 5 am' instead if 'always feeling like I've been awake for 3 days straight' so it might unfortunately, be hard to find an answer with non-medical substances. Being uncontrollably sleepy is devastating.",1643289243,hufnfdf,1,Narcolepsy,2022-01-27T13:14:03Z
lauraloo2,"We had a glass coffee table that spontaneously exploded. It's a thing,  Google it. Don't buy glass tables.",1643289225,hufne0x,1,therewasanattempt,2022-01-27T13:13:45Z
xmacv,"Just some random thoughts as I drink morning coffee:

* **Improve any branding or image the club has**
   * Professional looking logos
   * Other visual assets (colors, icons, etc.)
   * Just strive for consistency - come up with a visual that works and use it, a lot (FB, instagram, etc)
* **Find someone in your club who is good at this stuff**
   * Good photographer or good with digital imaging
   * Good at setting up a website and maintaining it
* In today's day and age, **I don't think iPhone pics really cut it**. So many people are able to produce insanely high quality content with budget gear (entry level mirrorless cameras for ex) You really need to focus on good looking content for it to reach that next level.

**What about the content itself?**

I think this is the hardest part.

Anything happen within the club is something to promote!

* League night? Take tonnes of 'higher quality' photos of the action - overlay your branding on the images and drop an instagram post with 10 pictures / same on Facebook
* Did a younger player compete in a tournament? Post a story about them, with high quality images, etc.
* Upcoming tournaments? Promote the crap out of it - again, high quality visuals/posters, branding.
* Create content that would appeal to a younger audience. Benefits of squash - exercise, healthy lifestyle, social elements, etc.
   * Although I will admit, squash is still very niche and not something that people just really '*pickup*'.",1643289218,hufndj2,1,squash,2022-01-27T13:13:38Z
Rounder057,I am still on my first cup of coffee after barely being awake so I was seriously put off by the idea that armadillos are the most edible mammals on earth,1643289211,hufnczp,1,interestingasfuck,2022-01-27T13:13:31Z
leofoxx,"It's like a community cafe. They are planning to do mental health activities and it seems to be run by the same people as Priscilla in Sanderstead and Whitgift. 

Op, try a Nero too. If you're going to stay there for the day with a cup of coffee, the big guys won't be as hurt as the little ones. If you go to MY do buy at least lunch or treats, they can do with the support.",1643289207,hufncop,1,croydon,2022-01-27T13:13:27Z
LegWorking5730,You must have scared it off with you willingness to get coffee.,1643289203,hufncef,1,niceguys,2022-01-27T13:13:23Z
Lord-Donkey,Psyllium husk and digestive enzymes.  XL coffee and long walk to gym.  Massive evacuations.,1643289197,hufnc16,1,steroids,2022-01-27T13:13:17Z
WaffleStomperGirl,"Yes. Very common. As someone who has lived in Canada, US, Aus, and NZ, it’s very common for someone to only say exactly what they want. 

Though it is worth recognizing the nuances in the body language that can differ between polite and impolite. 

For example, someone staring down at their phone when they get to the counter, not bothering to look up, and saying in a half dismissive tone “small coffee” is considered impolite, and quite rude. 

But you can say the same words with a cheerful attitude, smile, and courteous nod to the barista, and this is considered polite and warm. 

One main area of etiquette that requires more words is when you receive your order, if the person does not say thank you at all, they’re being very rude. 
Even a dismissive person will say thank you a lot of the time, as not to is the height of rudeness in this situation.",1643289185,hufnb4w,1,mildlyinfuriating,2022-01-27T13:13:05Z
userse31,“I am interested in the concept of trade. I give you 1.75 usd and you give me a hot beverage of coffee.”,1643289182,hufnax0,1,mildlyinfuriating,2022-01-27T13:13:02Z
marianoponceiii,"Is this for an Internet Service Provider (ISP) account? If it is, then try to remember how you troubleshoot your own connection at home when Internet is down.

Same goes if it's a tech support for consumer electronics or laptop, printer etc. How do you troubleshoot if these devices are not working properly?

If this is an Australian account, then walang masyadong mababago sa body clock mo since almost ka-Time Zome natin ang Australia. Unlike kung US company ito. Kung di ka sanay sa night shift, then bring coffee at the office. Swerte kung WFH setup.

At yung laging sinasabi nilang start by watching shows na US.

Good luck!",1643289175,hufnaf5,1,BPOinPH,2022-01-27T13:12:55Z
B2blackhawk,*White Male* Is it coffee with cream?,1643289171,hufna40,1,teenagers,2022-01-27T13:12:51Z
ltoloxa-,Coffee straight out the kettle,1643289163,hufn9la,1,aaaaaaacccccccce,2022-01-27T13:12:43Z
puffplz,"The best things I’ve noticed are not drinking any alcohol at all, limiting caffeine to one coffee per day maximum, lots of water, yoga every day (focus on movements that support lymphatic drainage), meditation and breathe work every day, posture training, and 7.5-8 hours (not more and not less) of sleep every night even on weekends while wearing mouth tape so that I never breath with my mouth open while sleeping.",1643289154,hufn8xg,1,Vindicta,2022-01-27T13:12:34Z
jimjimsmess,My German ancestory is less then 15% at this point but seems to apply. My great grand father on my mothers side was sent to south America by his (german) coffee company to work an operation there eventually meeting his wife and having 3 girls.  I am not sure of the actual dates but was before well before 1938,1643289145,hufn89l,1,IWantOut,2022-01-27T13:12:25Z
Momboobloverhere,"Coffee, your pretty face and cute titties 😍",1643289112,hufn621,1,CoffeeGoneWild,2022-01-27T13:11:52Z
marxr87,"This is end of act 1 reward. I feel like crown would be a pretty good pick even tho reddit seems to hate it and love coffee dripper. My deck is pretty legit, would really like nightmare, catalyst, maybe blur? Some card draw or discard would be nice but I think I'm in really good shape. Nightmare might be the hardest to find if I take crown, hopefully I see catalyst in a shop.",1643289107,hufn5mt,1,slaythespire,2022-01-27T13:11:47Z
RTheD77,"I spiraled after a break up several years ago. She dumped me and I wasn’t expecting it. But if I had read the signs I would have known it was coming. I was three months away from making the decision if I was going to marry her (I wanted to really think about it in the new year). My perception is that we as men assume since there aren’t arguments that everything is fine, but really it’s sometimes because the other person is really thinking about his or her thoughts about the future that they have sort of been considering their future too. There are always tells and looking back there were many. I realized that the year after when I would occasionally think about the relationship. It became clear to me I was trying to force a square peg into a round hole: me coming from a background where money was tight and I was doing really well financially to her, where money wasn’t even a concern because her family was rich but she couldn’t make any decent money on her own. She was also going through a crisis of faith while I was confident in my spirituality. Hers was performative, mine was my identity. I was an introvert and she was an attention seeker. 

Had I paid attention more I could have prevented some of the whiplash and I learned from it. The best thing I did was drink a cup of coffee any time I felt myself getting down, and then go for a bike ride or a run. Instead of spending time at home alone, I’d spend hours in the gym. Then I planned vacations, spending a month in South America and a month in Europe. Before long I forgot how to feel depressed but I also realized I could have done way better than I did, and learned to be responsible in my pursuits. I realized that if I had met her as a friend I wouldn’t have wanted to be friends, and that friendship is more important than attraction. Mental health is often tied to the people we interact with on a daily basis and if they aren’t helping you get better, you’re going to be more annoying to them in turn.

I can look back and laugh now about the absurdity of me dating someone like her and I even have had friends later on who said “yeah, that was a waste of your time,” but it was my responsibility to look out for my mental health back then and I wasn’t.",1643289098,hufn50z,1,science,2022-01-27T13:11:38Z
iwiml,"Black coffee i can do.
Lentils yea with the dinner with rice like a curry.
Need to add more protein source.

Munch on nuts in the evening for snacks...

Thank you :)",1643289096,hufn4xd,1,nutrition,2022-01-27T13:11:36Z
othersideofsad,"Cancer moon. 

I actually find physical touch calms me greatly (hugging, hand hold,etc) IF it is coming from the (small) circle of people I really trust. In the heat of the moment, I usually need to work through the shame of being upset. The best thing someone can do is pull up beside me with a good cup of coffee and talk about something else, or just sit and let it pass. 

If we are in public and I am visibly upset, I’m probably embarrassed. I need help shaking it off and carrying on rather than making a spectacle of it. If I do want to talk about it, I can guarantee I’m coming at it after overanalyzing both the situation and whether you’d want to hear about it. I’ll probably think I’m in a less emotional place and surprise myself when I start to speak and an emotion sneaks up. Something that is unhelpful at this point is if the person asks a hundred questions to the point of probing. I begin to question whether THEY are trying to judge the validity of my feelings and I kind of revert back to thinking I can deal with it alone. I think a lot of this may be the result of my upbringing rather than just my moon sign, however. Who knows.",1643289092,hufn4m3,1,astrology,2022-01-27T13:11:32Z
spongewardk,"Above it can be:

...&lt;blank stare&gt; -&gt; assertion of dominance, you don't even need to speak to get coffee. $100

Coffee $20",1643289086,hufn47o,1,mildlyinfuriating,2022-01-27T13:11:26Z
GeekyWoodsman,"Parasaurolophus.

I like a banana with my coffee",1643289070,hufn35k,1,CoffeeGoneWild,2022-01-27T13:11:10Z
blkbgfcsaz,"Hi! Yes I really think so, but more because I don't eat junk food anymore (except the occasional cheat meal), I don't drink alcohol anymore, and I don't eat spicy food as much. I also don't drink coffee high in acid anymore like I used to, I used to drink bustello and pilón but now I just drink a regular house blend. One other thing is not eating late at night close to bed time, I think that helped a lot.",1643289069,hufn33x,1,progresspics,2022-01-27T13:11:09Z
Pantuquero,"Ah yes, the ""not properly mixed milk coffee"". Classic",1643289065,hufn2sw,1,teenagers,2022-01-27T13:11:05Z
iDemonicAngelz,"Since it's for the community, I will give my thoughts although I did PM you. 

For Engineer, the new fourth bonus should make it fun again because it resembles the Exodia concept kinda from YugiOh if you ever played that. Otherwise the 3rd bonus with time machine is the way to go past i10 from what I can tell. Regarding strats, you want to try and go infinite with Sentinel rare and just spam Robo hounds. Robowitch and Iron Colossus for armor and armored plus the robot tags. Avoid overcharged although I generally get a Wizard III. The key trick is the new Ancient Azhar (strictly better than the clunky sphere of duplication (robot tag!) strat most high inferno users were relying on). Done correctly, you only need one of each card (Sentinel, Iron Colossus) to create a semi infinite combo with Azhar. If you get Key to the Portal skill, you go infinite. With all the robots tags in your deck, it scales very fast and can sometimes be a OTK. 

The other reliable and much easier strat to setup is Robot Burn similar to Shaman burn build those better than me have found. Usually same cards you always go for any Engineer run but if you dont get the classic Sentinel or iron Colossus,  you can try for a 1-2x Flamethrower. Use the new fire Demon ancient rare Megalorth I believe it's called (Tad tired, need coffee) that the Shaman burn build uses to scale the burn extremely fast. 

You want the classic defensive skills to setup the first turn or two against the enemies too. Think Frost Nova, Freezing Shot, Ice Block, Invisible Potion, etc. These allow you the breathing room to go infinite.

And as others have said and I have posted many times, when in doubt take a gem and heal. Transform a card. Remove a card. Sometimes it gets boring but generally a class either wants to go infinite (Wizard Fairies, Shaman Blesse Fairy Angels, etc) or wants a slim deck (4 cards ideally with tons of exile to get there) and abusing Circulsr shield. 

Have fun. Good luck!",1643289062,hufn2lq,1,RogueAdventure,2022-01-27T13:11:02Z
Canz98,"Sorry, wouldnt bulletproof coffee take you out of a fast? Asking as a newbie",1643289059,hufn2h1,1,keto,2022-01-27T13:10:59Z
HermanMunsterCheese,"I am 72, and still walk every day to/from meeting a group of friends every morning for coffee, do my own yardwork, work on my roof, cut down trees for firewood, clear brush, and spend a few weeks every year digging &amp; panning for gold and semi-precious gemstones as a hobby. 

I worked as a Master Stonemason in luxury home construction my entire life, and credit daily physical exercise for 50+ years to my strength and flexibility now. I have had a lifetime of daily hard physical work - it feels good to me, keeps the blood pumping, and I can see no reason to stop now. One day leads to another, and I feel pretty good every day when I move around, so I am active, rain or shine. 

It's 22°F outside this morning, and I am getting ready to leave the house to meet my friends for coffee, hit the hardware store, and fix my back gate. Then I need to split up some kindling for the fireplace because we are supposed to have moresnow on Friday night. Gotta keep moving, I've got stuff to do!",1643289054,hufn22p,1,AskOldPeople,2022-01-27T13:10:54Z
